{
  "schema_version": "reigns_event_pack.v1",
  "pack_id": "ko.a1.reigns.pilot.v1",
  "status": "draft",
  "target_lang": "ko",
  "support_lang": "zh_tw",
  "level": "A1",
  "events": [
    {
      "event_id": "ko.a1.reigns.appointment_time.001",
      "level": "A1",
      "scene_type": "appointment_time",
      "register": "polite_safe",
      "difficulty": 2,
      "setup": {
        "zh_tw": "同學想約你明天一起讀韓文，你需要確認時間。",
        "en": "A classmate wants to study Korean with you tomorrow, and you need to confirm the time."
      },
      "npc_speaker_id": "classmate",
      "npc_utterance": {
        "ko": "내일 만날까요?",
        "zh_tw": "明天要見面嗎？",
        "en": "Shall we meet tomorrow?"
      },
      "choices": [
        {
          "choice_id": "confirm_three_pm",
          "text": {
            "ko": "세 시에 만날 거예요.",
            "zh_tw": "三點見。",
            "en": "I will meet at three."
          },
          "result": "success",
          "reaction": {
            "zh_tw": "同學把三點記在行事曆裡。",
            "en": "The classmate writes three o'clock in the calendar."
          },
          "pal_tip": {
            "zh_tw": "A1 可以開始用「-ㄹ 거예요」說接下來的安排。",
            "en": "At A1, you can use -ㄹ 거예요 to state a coming plan."
          }
        },
        {
          "choice_id": "past_time_mismatch",
          "text": {
            "ko": "어제 만났어요.",
            "zh_tw": "昨天見面了。",
            "en": "We met yesterday."
          },
          "result": "error",
          "error_type": "tense_mismatch",
          "reaction": {
            "zh_tw": "同學以為你在說過去的事，沒有得到明天的時間。",
            "en": "The classmate thinks you are talking about the past and does not get tomorrow's time."
          },
          "pal_tip": {
            "zh_tw": "約明天是未來安排，用「만날 거예요」比過去式自然。",
            "en": "For tomorrow's plan, 만날 거예요 is more natural than a past-tense sentence."
          }
        }
      ],
      "coverage": {
        "vocab": ["ko:vocab:내일", "ko:vocab:세 시", "ko:vocab:만나다"],
        "grammar": ["ko:grammar:a1.future_intention"],
        "patterns": ["ko:pattern:a1.schedule_time"],
        "scene_tags": ["schedule", "time", "appointment", "plans", "future"]
      },
      "tags": ["survival", "schedule", "two_choice"],
      "prerequisites": []
    },
    {
      "event_id": "ko.a1.reigns.food_preference.001",
      "level": "A1",
      "scene_type": "food_preference",
      "register": "polite_safe",
      "difficulty": 2,
      "setup": {
        "zh_tw": "朋友問你午餐想吃什麼，你想表達自己的偏好。",
        "en": "A friend asks what you want for lunch, and you want to express your preference."
      },
      "npc_speaker_id": "friend",
      "npc_utterance": {
        "ko": "뭐 먹고 싶어요?",
        "zh_tw": "想吃什麼？",
        "en": "What do you want to eat?"
      },
      "choices": [
        {
          "choice_id": "say_bibimbap_like",
          "text": {
            "ko": "비빔밥을 좋아해요.",
            "zh_tw": "我喜歡拌飯。",
            "en": "I like bibimbap."
          },
          "result": "success",
          "reaction": {
            "zh_tw": "朋友說附近有一家拌飯店。",
            "en": "Your friend says there is a bibimbap place nearby."
          },
          "pal_tip": {
            "zh_tw": "「名詞 + 을/를 좋아해요」是 A1 表達偏好的核心句型。",
            "en": "Noun + 을/를 좋아해요 is a core A1 pattern for preferences."
          }
        },
        {
          "choice_id": "say_price_food_mismatch",
          "text": {
            "ko": "비빔밥이 얼마예요?",
            "zh_tw": "拌飯多少錢？",
            "en": "How much is bibimbap?"
          },
          "result": "error",
          "error_type": "intent_mismatch",
          "reaction": {
            "zh_tw": "朋友以為你在問價格，還是不知道你想吃什麼。",
            "en": "Your friend thinks you are asking the price and still does not know what you want."
          },
          "pal_tip": {
            "zh_tw": "對方問偏好時，用「좋아해요」比問價格更符合情境。",
            "en": "When asked about preference, 좋아해요 fits better than asking price."
          }
        }
      ],
      "coverage": {
        "vocab": ["ko:vocab:비빔밥", "ko:vocab:먹다", "ko:vocab:좋아하다"],
        "grammar": ["ko:grammar:a1.object_particle"],
        "patterns": ["ko:pattern:a1.preference"],
        "scene_tags": ["food", "preference", "restaurant"]
      },
      "tags": ["survival", "food", "two_choice"],
      "prerequisites": ["ko.a1.reigns.appointment_time.001"]
    },
    {
      "event_id": "ko.a1.reigns.shopping_size.001",
      "level": "A1",
      "scene_type": "shopping_size_compare",
      "register": "polite_safe",
      "difficulty": 2,
      "setup": {
        "zh_tw": "你試穿一件外套，但尺寸有點大，想請店員拿小一點的。",
        "en": "You try on a jacket, but it is a little big, and you want a smaller one."
      },
      "npc_speaker_id": "clerk",
      "npc_utterance": {
        "ko": "사이즈 괜찮으세요?",
        "zh_tw": "尺寸可以嗎？",
        "en": "Is the size okay?"
      },
      "choices": [
        {
          "choice_id": "ask_smaller_one",
          "text": {
            "ko": "더 작은 거 있어요?",
            "zh_tw": "有更小的嗎？",
            "en": "Do you have a smaller one?"
          },
          "result": "success",
          "reaction": {
            "zh_tw": "店員拿來小一號的外套。",
            "en": "The clerk brings a smaller jacket."
          },
          "pal_tip": {
            "zh_tw": "比較尺寸時，「더 작은 거」很實用，意思是更小的那個。",
            "en": "For size comparison, 더 작은 거 is useful: the smaller one."
          }
        },
        {
          "choice_id": "say_like_only",
          "text": {
            "ko": "이거 좋아해요.",
            "zh_tw": "我喜歡這個。",
            "en": "I like this."
          },
          "result": "error",
          "error_type": "missing_comparison",
          "reaction": {
            "zh_tw": "店員以為你喜歡這件，沒有換尺寸。",
            "en": "The clerk thinks you like this one and does not change the size."
          },
          "pal_tip": {
            "zh_tw": "如果問題是大小，要說「더 작은 거」或「더 큰 거」。",
            "en": "If the issue is size, say 더 작은 거 or 더 큰 거."
          }
        }
      ],
      "coverage": {
        "vocab": ["ko:vocab:사이즈", "ko:vocab:작다", "ko:vocab:옷"],
        "grammar": ["ko:grammar:a1.descriptive_adjectives"],
        "patterns": ["ko:pattern:a1.comparison_choice"],
        "scene_tags": ["shopping", "comparison", "size"]
      },
      "tags": ["survival", "shopping", "two_choice"],
      "prerequisites": ["ko.a1.reigns.food_preference.001"]
    },
    {
      "event_id": "ko.a1.reigns.transport_destination.001",
      "level": "A1",
      "scene_type": "transportation_route",
      "register": "polite_safe",
      "difficulty": 2,
      "setup": {
        "zh_tw": "你想搭車從首爾站到弘大，正在向站務人員確認路線。",
        "en": "You want to travel from Seoul Station to Hongdae and are checking the route with station staff."
      },
      "npc_speaker_id": "station_staff",
      "npc_utterance": {
        "ko": "어디까지 가세요?",
        "zh_tw": "您要到哪裡？",
        "en": "How far are you going?"
      },
      "choices": [
        {
          "choice_id": "from_seoul_to_hongdae",
          "text": {
            "ko": "서울역에서 홍대까지 가요.",
            "zh_tw": "從首爾站到弘大。",
            "en": "I go from Seoul Station to Hongdae."
          },
          "result": "success",
          "reaction": {
            "zh_tw": "站務人員告訴你要搭哪一線。",
            "en": "The station staff tells you which line to take."
          },
          "pal_tip": {
            "zh_tw": "「에서」標起點，「까지」標終點。A1 交通情境很常用。",
            "en": "에서 marks the start, and 까지 marks the endpoint. This is common in A1 transport scenes."
          }
        },
        {
          "choice_id": "only_hongdae_missing_start",
          "text": {
            "ko": "홍대가 좋아요.",
            "zh_tw": "弘大很好。",
            "en": "Hongdae is good."
          },
          "result": "error",
          "error_type": "missing_route",
          "reaction": {
            "zh_tw": "站務人員知道地點，但還不清楚你的路線。",
            "en": "The staff knows the place, but not your route."
          },
          "pal_tip": {
            "zh_tw": "確認路線時，把起點和終點一起說清楚。",
            "en": "When checking a route, state both starting point and destination."
          }
        }
      ],
      "coverage": {
        "vocab": ["ko:vocab:서울역", "ko:vocab:홍대", "ko:vocab:가다"],
        "grammar": ["ko:grammar:a1.from_to_particles"],
        "patterns": ["ko:pattern:a1.transport_destination"],
        "scene_tags": ["transportation", "directions", "travel"]
      },
      "tags": ["survival", "transportation", "two_choice"],
      "prerequisites": ["ko.a1.reigns.shopping_size.001"]
    },
    {
      "event_id": "ko.a1.reigns.past_movie.001",
      "level": "A1",
      "scene_type": "past_experience_report",
      "register": "polite_safe",
      "difficulty": 2,
      "setup": {
        "zh_tw": "朋友問你昨天做了什麼，你想用一句話回答。",
        "en": "A friend asks what you did yesterday, and you want to answer in one sentence."
      },
      "npc_speaker_id": "friend",
      "npc_utterance": {
        "ko": "어제 뭐 했어요?",
        "zh_tw": "昨天做了什麼？",
        "en": "What did you do yesterday?"
      },
      "choices": [
        {
          "choice_id": "watched_movie_past",
          "text": {
            "ko": "영화를 봤어요.",
            "zh_tw": "看了電影。",
            "en": "I watched a movie."
          },
          "result": "success",
          "reaction": {
            "zh_tw": "朋友接著問你電影好不好看。",
            "en": "Your friend asks whether the movie was good."
          },
          "pal_tip": {
            "zh_tw": "回答昨天的事，要用過去式。A1 常見形是「봤어요」。",
            "en": "For yesterday, use past tense. A common A1 form is 봤어요."
          }
        },
        {
          "choice_id": "movie_future_mismatch",
          "text": {
            "ko": "영화를 볼 거예요.",
            "zh_tw": "我要看電影。",
            "en": "I will watch a movie."
          },
          "result": "error",
          "error_type": "tense_mismatch",
          "reaction": {
            "zh_tw": "朋友以為你在說之後的計畫。",
            "en": "Your friend thinks you are talking about a future plan."
          },